{
 "generated": "hand-made fixture for the web renderer's tests; not a real film",
 "fps_num": 25,
 "fps_den": 1,
 "width": 320,
 "height": 180,
 "total_frames": 50,
 "acts": [{"index": 1, "name": "One", "shots": ["W01", "W02"]}],
 "shots": [
  {"id": "W01", "act": 1, "frame_in": 0, "frame_out": 25, "frames": 25, "sec_in": 0.0, "sec_out": 1.0, "vo": "", "on_screen": ""},
  {"id": "W02", "act": 1, "frame_in": 25, "frame_out": 50, "frames": 25, "sec_in": 1.0, "sec_out": 2.0, "vo": "", "on_screen": ""}
 ]
}
