{
 "generated": "test fixture: a one-act, 30-frame film for the engine's tests",
 "fps_num": 30,
 "fps_den": 1,
 "width": 320,
 "height": 180,
 "total_frames": 30,
 "acts": [
  {"index": 1, "name": "A square crosses", "shots": ["S01", "S02"]}
 ],
 "shots": [
  {"id": "S01", "act": 1, "frame_in": 0, "frame_out": 15, "frames": 15, "sec_in": 0.0, "sec_out": 0.5, "vo": "", "on_screen": "A square"},
  {"id": "S02", "act": 1, "frame_in": 15, "frame_out": 30, "frames": 15, "sec_in": 0.5, "sec_out": 1.0, "vo": "", "on_screen": "crosses the frame"}
 ]
}
